{
  "schemaVersion": 1,
  "kind": "equipment",
  "id": "ottoman.early-modern.janissary.equipment-basic.v1",
  "civilization": "ottoman",
  "period": "early-modern",
  "role": "janissary",
  "variant": "equipment-basic",
  "version": 1,
  "status": "placeholder",
  "review": "pending",
  "provenance": {
    "source": "placeholder",
    "rights": "pending",
    "historicalReview": "unreviewed",
    "sources": [],
    "notes": "Structural example only. No generated design, historical approval or production readiness."
  },
  "files": [],
  "characterId": "ottoman.early-modern.janissary.default.v1",
  "items": []
}
